26,hdockrill0,mF7&bS7.}M,Aliquam non mauris. Morbi non lectus.,1-
27,hharewood1,dV2<FfS*/,Phasellus id sapien in sapien iaculis congue.,1-
28,rbarrs2,"qZ9?%i<_A.,)!",Cras pellentesque volutpat dui.,1-
29,corta3,sP6/'ou#%*f1yn\s,Maecenas pulvinar lobortis est.,1-
30,sdiamant4,oY2>xWj~.g@F\`'X,Quisque id justo sit amet sapien dignissim vestibulum. Vestibulum ante ipsum primis in faucibus orci luctus et ultrices posuere cubilia Curae; Nulla dapibus dolor vel est.,1-
31,jpauls5,eD9*ge5Fez,Aenean fermentum. Donec ut mauris eget massa tempor convallis.,1-
32,fdaviot6,xG2.oGw'CZ`MZqlz,"Integer non velit. Donec diam neque, vestibulum eget, vulputate ut, ultrices vel, augue.",1-
33,zharesnaip7,"iX3&XuK7,>6k&","Cum sociis natoque penatibus et magnis dis parturient montes, nascetur ridiculus mus.",1-
34,sdoogood8,eZ6%LZ{eHkrw,Suspendisse accumsan tortor quis turpis. Sed ante.,1-
35,jduesberry9,xE8(KvH\,Proin risus.,1-
36,ehuxhama,vK6_+(h0r,"Donec vitae nisi. Nam ultrices, libero non mattis pulvinar, nulla pede ullamcorper augue, a suscipit nulla elit ac nulla.",1-
37,fokillb,xN6\S%UW/@%=*L,Integer tincidunt ante vel ipsum.,1-
38,edungatec,"tD8={YB#`D,@SJe4","Mauris enim leo, rhoncus sed, vestibulum sit amet, cursus id, turpis. Integer aliquet, massa id lobortis convallis, tortor risus dapibus augue, vel accumsan tellus nisi eu orci.",1-
39,iwesthoferd,lB1+~+)JNym3},"Nulla neque libero, convallis eget, eleifend luctus, ultricies eu, nibh. Quisque id justo sit amet sapien dignissim vestibulum.",1-
40,ftearnye,cX5*?|hw9SD,Aliquam sit amet diam in magna bibendum imperdiet.,1-
41,lottawellf,iQ5\*FFI\QS,Sed sagittis.,1-
42,mkilfederg,jW2@pNI)GTRU,Donec vitae nisi.,1-
43,jlegendreh,dF6.Nk_lT,Integer ac neque.,1-
44,vhallewelli,vT1>byh4r.?,"Quisque erat eros, viverra eget, congue eget, semper rutrum, nulla.",1-
45,vescaleraj,dE5>RmiNMRGslhP,"Cum sociis natoque penatibus et magnis dis parturient montes, nascetur ridiculus mus.",1-
46,tfilkink,aX1$%*?Wau3E+AdX,"Morbi sem mauris, laoreet ut, rhoncus aliquet, pulvinar sed, nisl. Nunc rhoncus dui vel sem.",1-
47,hpitherickl,"fS4.9""F=VA#{2","Lorem ipsum dolor sit amet, consectetuer adipiscing elit. Proin risus.",1-
48,gleatm,oY5&9EMy*4,Nullam porttitor lacus at turpis.,1-
49,cwanelln,hE6{7IerRAKU&Jq,Duis at velit eu est congue elementum.,1-
50,bjordineo,sX3+r1+3#Cj,Curabitur at ipsum ac tellus semper interdum.,1-
